[
  {
    "doc_id": "DOC-01",
    "title": "Key and certificate portal architecture diagram (draw.io source)",
    "client_doc_ref": "architecture.drawio",
    "date_received": "2026-09-18",
    "owner": "client",
    "environment": "prod",
    "doc_type": "diagram",
    "sha256": "a732672c27e9aa52173b64745df94778757c403671bce26586cc74d58b71cf02",
    "read_status": "parsed",
    "reading_method": "parsed",
    "page_methods": [
      {
        "page": 1,
        "method": "parsed"
      }
    ],
    "precedence_rank": 5,
    "used_for": "Components, containers, subnets and arrows",
    "ignored_and_why": "The unlabelled dashed box around the CDN, portal UI bucket, API gateway and token authorizer is not used as a zone: it has no label and no text confirms it. Arrows have no labels, so no protocol was read from them."
  },
  {
    "doc_id": "DOC-02",
    "title": "Key and certificate portal architecture diagram (image export)",
    "client_doc_ref": "architecture.png",
    "date_received": "2026-09-18",
    "owner": "client",
    "environment": "prod",
    "doc_type": "diagram",
    "sha256": "ac8c8b167880959551d4d90fa03445c241445513c98946739a1416606118234e",
    "read_status": "parsed",
    "reading_method": "image_model",
    "page_methods": [
      {
        "page": 1,
        "method": "image_model"
      }
    ],
    "precedence_rank": 5,
    "used_for": "Cross-check of the labels and arrows read from DOC-01",
    "ignored_and_why": "No facts taken from it: it is an image export of DOC-01, whose source file was read directly."
  },
  {
    "doc_id": "DOC-03",
    "title": "Answers to intake questions",
    "client_doc_ref": "client-answers.md",
    "date_on_document": "2026-09-15",
    "date_received": "2026-09-18",
    "owner": "client",
    "environment": "dev",
    "doc_type": "qa",
    "sha256": "b51353cf53a02d20982202fb9d70d7a55662854b97b8a14f68dcf6a046f969df",
    "read_status": "parsed",
    "reading_method": "parsed",
    "precedence_rank": 3,
    "used_for": "Entry points, sign-in, keys, secrets, notifications, deployment, logging and stored data",
    "ignored_and_why": "Answer 12 (monthly running cost) ignored, not relevant to security."
  },
  {
    "doc_id": "DOC-04",
    "title": "Functional description, version 0.3",
    "client_doc_ref": "functional.md",
    "date_received": "2026-09-18",
    "owner": "client",
    "environment": "unknown",
    "doc_type": "functional",
    "sha256": "59857567efddbee858b1ff9c1824014cb7d0f38c3338f6fa8137f4c4652e83ae",
    "read_status": "parsed",
    "reading_method": "parsed",
    "precedence_rank": 7,
    "used_for": "Actors, functions, endpoints and the revocation list publisher",
    "ignored_and_why": ""
  }
]
